{"id": 0, "source": "Conditioned Games - Straight Drives, Crosses & kills.docx", "type": "conditioned game", "participants": "2", "duration": "60min", "squashLevel": "Medium", "fitness": "Medium", "intensity": "Medium", "primaryShots": ["deep drive", "hard drive", "straight drive", "cross kill", "volley cross kill", "hard cross", "volley cross", "volley hard cross", "straight lob"], "secondaryShots": ["deep drive", "hard drive", "straight drive", "cross kill", "volley cross kill", "hard cross", "volley cross", "volley hard cross", "straight lob"], "shots": ["drive", "cross", "lob", "drop", "boast", "volley", "kill"], "shotSide": ["forehand", "backhand"], "contents": "Type: conditioned game\nParticipants: 2\nDuration: 60min\nIs_general: false\nPrimaryShots: straight drive, cross deep, cross kill, volley cross, volley cross kill, volley hard cross, hard cross\nSecondaryShots: deep drive, straight lob, hard drive\nShotTypes: volley, drive, cross, lob, drop\nShotSide: forehand, backhand\nsquashLevel: Medium\nIntensity: Medium\nFitness: Medium\nIntensity: Medium\n\nLeg workout: Medium\nArm workout: Medium\nSupport doc: Null\n\nFocus: Mastering Deep Drive Foundations and Strategic Cross-Court Attack Combinations\nRest time between exercises: 1min30sec\n\n\n\nWARM-UP (10min)\n2min30sec: Boast– Drive – Drop – Drive (Sequence: Player A boasts → Player B drives → Player A drops → Player B drives)\n2min30sec: Boast – Drive 2 shots (keep same positions) (Sequence: Player A drives and then plays a boast (2 shots) → Player B drops and then plays a drives (2 shots)\nSwitch roles and repeat the exercises above\nSESSION\nConditioned Game 1 (deep only)\nFirst to 7 points (forehand): Deep Drives (rules: first bounce of the ball on the floor must land behind the T-line)\nFirst to 7 points (backhand): Deep Drives (rules: first bounce of the ball on the floor must land behind the T-line)\nConditioned Game 2 (kill allowed)\nFirst to 9 points (forehand): Drives with Kills (rules: second bounce of the ball on the floor must land behind the T-line)\nFirst to 9points (backhand): Drives with Kills (rules: second bounce of the ball on the floor must land behind the T-line)\nConditioned Game 3 (deep only)\nFirst to 7 points (both sides): Drive – Drive – Cross (rules: players must switch their cross side every rally)\nConditioned Game 4 (kill allowed)\nFirst to 9 points (both sides): Drive – Drive – Cross with Kills (rules: players must switch their cross side every rally and kills are allowed)\n\nConditioned Game 5 (kill allowed)\nFirst to 9points (forehand): Drives with Cross (rules: a player can cross if (s)he positioned in front of their opponent)\nFirst to 9points (backhand): Drives with Cross (rules: a player can cross if (s)he positioned in front of their opponent)\nEnd of session.\n\n\n\n\n"}
{"id": 1, "source": "Conditioned Games - Straight and Diagonal Games.docx", "type": "conditioned game", "participants": "2", "duration": "60min", "squashLevel": "Medium", "fitness": "Medium", "intensity": "Medium", "primaryShots": ["2-wall boast", "3-wall boast", "cross drop", "straight drop", "deep drive", "hard drive", "straight drive", "volley straight drive", "straight kill", "cross lob", "deep cross", "cross deep", "hard cross", "straight lob"], "secondaryShots": ["2-wall boast", "3-wall boast", "cross drop", "straight drop", "deep drive", "hard drive", "straight drive", "volley straight drive", "straight kill", "cross lob", "deep cross", "cross deep", "hard cross", "straight lob"], "shots": ["drive", "cross", "lob", "drop", "boast", "volley", "kill"], "shotSide": ["forehand", "backhand"], "contents": "Type: conditioned game\nParticipants: 2\nDuration: 60min\nIs_general: true\nPrimaryShots: straight drive, straight drop, cross deep, cross drop, deep cross, deep drive, straight kill, volley straight drive\nSecondaryShots: 2-wall boast, 3-wall boast, hard drive, hard cross, straight lob, cross lob\nShotTypes: volley, drive, cross, lob, drop, boast\nShotSide: forehand, backhand\n\nsquashLevel: Medium\nIntensity: Medium\nFitness: Medium\nIntensity: Medium\n\nLeg workout: Medium\nArm workout: Medium\nSupport doc: Null\n\nFocus: Mastering Strategic Shot Variation and All-Court Movement through Progressive Zonal and Learning to move the opponent around the court.\nRest time between exercises: 1min30sec\n\n\nWARM-UP (10min)\n2min30sec: Boast– Drive – Drop – Drive (Sequence: Player A boasts → Player B drives → Player A drops → Player B drives)\n2min30sec: Boast – Drive 2 shots (keep same positions) (Sequence: Player A drives and then plays a boast (2 shots) → Player B drops and then plays a drives (2 shots)\nSwitch roles and repeat the exercises above\nSESSION\nConditioned Game 1\nFirst to 9 points (forehand): Drives with Kills (rules: second bounce of the ball on the floor must land behind the T-line)\nFirst to 9 points (backhand): Drives with Kills (rules: second bounce of the ball on the floor must land behind the T-line)\n\nConditioned Game 2\nFirst to 11 points (forehand): Alley Game  (rules: Play only on the right side of the court, short or long, but in the alley delimited by the service box)\nFirst to 11 points (backhand): Alley Game (rules: Play only on the left side of the court, short or long, but in the alley delimited by the service box)\n\nConditioned Game 3\nFirst to 11 points (forehand): Diagonale Game (rules: the ball first bounce must land in the designated areas)\nFirst to 11 points (backhand): Diagonale Game (rules: the ball first bounce must land in the designated areas) \n\nConditioned Gamed 4\nFirst to 11 points (both sides): Never Twice In The Same Square (rules: you are not allowed to play 2 times in a row in the same area of the court)\n\nConditioned Gamed 5\nFirst to 11 points: Free Game\n\nEnd of session."}
{"id": 2, "source": "Conditioned Games - Alley Games with Cross Lob switch.docx", "type": "conditioned game", "participants": "2", "duration": "60min", "squashLevel": "Medium", "fitness": "Medium", "intensity": "Medium", "primaryShots": ["counter drop", "straight drop", "deep drive", "hard drive", "straight drive", "straight kill", "cross lob", "lob cross", "deep cross", "cross deep"], "secondaryShots": ["counter drop", "straight drop", "deep drive", "hard drive", "straight drive", "straight kill", "cross lob", "lob cross", "deep cross", "cross deep"], "shots": ["drive", "cross", "lob", "drop", "boast", "volley", "kill"], "shotSide": ["forehand", "backhand"], "contents": "Type: conditioned game\nParticipants: 2\nDuration: 60min\nIs_general: false\nPrimaryShots: straight drive, cross lob\nSecondaryShots: straight kill, deep drive, hard drive, straight drop, counter drop\nShotTypes: drive, drop, volley, cross\nShotSide: forehand, backhand\nsquashLevel: Medium\nIntensity: Medium\nFitness: Medium\nIntensity: Medium\n\nLeg workout: Medium\nArm workout: Medium\nSupport doc: Null\n\nFocus: Developing Foundational Straight Game Control and Strategic Cross Lob Application.\nRest time between exercises: 1min30sec\n\n\nWARM-UP (10min)\n2min30sec: Boast– Drive – Drop – Drive (Sequence: Player A boasts → Player B drives → Player A drops → Player B drives)\n2min30sec: Boast – Drive 2 shots (keep same positions) (Sequence: Player A drives and then plays a boast (2 shots) → Player B drops and then plays a drives (2 shots)\nSwitch roles and repeat the exercises above\n\nSESSION\nCondition Game 1\nFirst to 11 points (forehand): Drives No Volleys (rules: each player has to place at least one foot on the T line after hitting their shot. If a player hits a shot and did not go back to the t-line before then the point is automatically lost. Kills are allowed)\nFirst to 11 points (backhand): Drives No Volleys (rules: each player has to place at least one foot on the T line after hitting their shot. If a player hits a shot and did not go back to the t-line before then the point is automatically lost. Kills are allowed)\n\nCondition Game 2\nFirst to 11 points (forehand): Alley Game\nFirst to 11 points (backhand): Alley Game\n\nCondition Game 3\nFirst to 11 points (both sides): Alley Game with Lob Cross from the front\nFirst to 11 points (both sides): Alley Game with Lob Cross from the back\n\nCondition Game 4\nFirst to 11 points: Free Game (rules: if squeeze your opponent with a straight shot, i.e. the ball was too tight against the side wall, then you win 2 points)\nEnd of session.\n"}
{"id": 3, "source": "Conditioned Games - Length Game and Straight kills with 1 boast or straight drop attacking options.docx", "type": "conditioned game", "participants": "2", "duration": "60min", "squashLevel": "Medium", "fitness": "Medium", "intensity": "Medium", "primaryShots": ["2-wall boast", "3-wall boast", "cross drop", "straight drop", "volley cross drop", "volley straight drop", "straight drive", "straight kill", "cross kill", "volley cross"], "secondaryShots": ["2-wall boast", "3-wall boast", "cross drop", "straight drop", "volley cross drop", "volley straight drop", "straight drive", "straight kill", "cross kill", "volley cross"], "shots": ["drive", "cross", "lob", "drop", "boast", "volley", "kill"], "shotSide": ["forehand", "backhand"], "contents": "Type: conditioned game\nParticipants: 2\nDuration: 60min\nIs_general: true\nPrimaryShots: straight drive, deep cross, straight drop, volley straight drop, volley cross drop, 2-wall boast, 3-wall boast\nSecondaryShots: straight kill, cross kill, straight drive\nShotTypes: volley, drive, cross, lob, drop, boast\nShotSide: forehand, backhand\n\nsquashLevel: Medium\nIntensity: Medium\nFitness: Medium\nIntensity: Medium\n\nLeg workout: Medium\nArm workout: Medium\nSupport doc: Null\n\nFocus: Developing a Dominant Deep Length Game, Complemented by Strategic and Precise Short Attack Deployment\nRest time between exercises: 1min30sec\n\nWARM-UP (10min)\n2min30sec: Boast – Drive – Drop – Drive (Sequence: Player A boasts → Player B drives → Player A drops → Player B drives)\n2min30sec: Boast – Drive 2 shots (keep same positions) (Sequence: Player A drives and then plays a boast (2 shots) → Player B drops and then plays a drives (2 shots)\nSwitch roles and repeat the exercises above\nSESSION\nConditioned Game 1 (deep only)\nFirst to 7 points (forehand): Deep Drives (rules: first bounce of the ball on the floor must land behind the T-line)\nFirst to 7 points (backhand): Deep Drives (rules: first bounce of the ball on the floor must land behind the T-line)\nConditioned Game 2\nFirst to 11 points (both sides): Length Game with 1 Straight Drop (rules: 2nd bounce of the ball on the floor must land behind the T-line. Each player can play a straight drop off the bounce one time per rally. The response after the drop must be a deep)\n\nConditioned Game 2\nFirst to 11 points (both sides): Length Game with 1 Boast (rules: second bounce of the ball on the floor must land behind the T-line. Each player can play a boast off the bounce one time per rally. The response after the drop must be a deep)\n\nConditioned Game 4\nFirst to 11 points (both sides): Length Game with 1 Volley Straight Drop (rules: second bounce of the ball on the floor must land behind the T-line. Each player can play a volley straight drop per rally. The response after the drop must be a deep)\nFirst to 11 points (both sides): Length Game with 1 Volley Cross Drop (rules: second bounce of the ball on the floor must land behind the T-line. Each player can play a volley straight drop per rally. The response after the drop must be a deep)\nConditioned Game 5\nFirst to 11 points: Free Game\n\nEnd of session.\n\n\n\n\n\n\n\n "}
{"id": 4, "source": "Conditioned Game - Front versus Back.docx", "type": "conditioned game", "participants": "2", "duration": "60min", "squashLevel": "Advanced", "fitness": "Medium", "intensity": "High", "primaryShots": ["cross drop", "straight drop", "straight drive", "volley straight drive", "straight kill", "cross kill", "cross lob", "deep cross", "cross deep", "cross wide", "wide cross", "straight lob", "volley drive"], "secondaryShots": ["cross drop", "straight drop", "straight drive", "volley straight drive", "straight kill", "cross kill", "cross lob", "deep cross", "cross deep", "cross wide", "wide cross", "straight lob", "volley drive"], "shots": ["drive", "cross", "lob", "drop", "boast", "volley", "kill"], "shotSide": ["forehand", "backhand"], "contents": "Type: conditioned game\nParticipants: 2\nDuration: 60min\nIs_general: true\nPrimaryShots: null\nSecondaryShots: straight kill, cross kill, straight drive, straight drop, cross drop, cross lob, straight lob, cross wide, cross deep\nShotTypes: volley, drive, cross, lob, drop, boast\nShotSide: forehand, backhand\nsquashLevel: Advanced\nIntensity: High\nFitness: Medium\n\nLeg workout: High\nArm workout: Medium\nSupport doc: Null\n\nFocus: Mastering high variations of deep shots from the front of the court and high variations of short shots from the back of the court.\nRest time between exercises: 1min30sec\n\n\nWARM-UP (10min)\n2min30sec: Boast– Drive – Drop – Drive (Sequence: Player A boasts → Player B drives → Player A drops → Player B drives)\n2min30sec: Boast – Drive 2 shots (keep same positions) (Sequence: Player A drives and then plays a boast (2 shots) → Player B drops and then plays a drives (2 shots)\nSwitch roles and repeat the exercises above\nSESSION\n\nConditioned Game 1\nFirst to 9 points (forehand): Front versus Back with Deep Shots Only (rules: Player A must play every shot first bounce behind the line. Player B must play only short soft shots, i.e. boasts and drops)\nFirst to 9 points (backhand): Front versus Back with Deep Shots Only (rules: Player B must play every shot first bounce behind the line. Player A must play only short soft shots, i.e. boasts and drops)\n\nConditioned Game 2\nFirst to 9 points (forehand): Front versus Back with Kills (rules: Player A must play every shot second bounce behind the line. Player B must play only short soft shots, i.e. boasts and drops)\nFirst to 9 points (backhand): Front versus Back with Kills (rules: Player B must play every shot second bounce behind the line. Player A must play only short soft shots, i.e. boasts and drops)\nConditioned Game 3\nFirst to 9 points (forehand): Front versus Back with Kills and One Drive (rules: Player A must play every shot second bounce behind the line. Player B must play only short soft shots, i.e. boasts and drops, but one time per rally can play a straight drive)\nFirst to 9 points (backhand): Front versus Back with Kills and One Drive (rules: Player B must play every shot second bounce behind the line. Player A must play only short soft shots, i.e. boasts and drops, but one time per rally can play a volley straight drive)\nConditioned Game 4\nFirst to 9 points (forehand): Front versus Back with Kills and One Volley Drive (rules: Player A must play every shot second bounce behind the line. Player B must play only short soft shots, i.e. boasts and drops, but one time per rally can play a volley straight drive)\nFirst to 9 points (backhand): Front versus Back with Kills and One Volley Drive (rules: Player B must play every shot second bounce behind the line. Player A must play only short soft shots, i.e. boasts and drops, but one time per rally can play a volley straight drive)\n\nEnd of session.\n\n\n\n\n\n\n"}
{"id": 5, "source": "Conditioned Games - Boast and Straight Drives.docx", "type": "conditioned game", "participants": "2", "duration": "60min", "squashLevel": "Medium", "fitness": "Medium", "intensity": "Medium", "primaryShots": ["2-wall boast", "3-wall boast", "counter drop", "deep drive", "hard drive", "straight drive", "straight lob"], "secondaryShots": ["2-wall boast", "3-wall boast", "counter drop", "deep drive", "hard drive", "straight drive", "straight lob"], "shots": ["drive", "lob", "drop", "boast"], "shotSide": ["forehand", "backhand"], "contents": "Type: conditioned game\nParticipants: 2\nDuration: 60min\nIs_general: false\nPrimaryShots: straight drive, counter drop, 2-wall boast, 3-wall boast\nSecondaryShots: deep drive, hard drive, straight lob\nShotTypes: drive, drop\nShotSide: forehand, backhand\nsquashLevel: Medium\nIntensity: Medium\nFitness: Medium\n\nLeg workout: Medium\nArm workout: Medium\nSupport doc: Null\n\nFocus: Mastering the Strategic Interplay of Short Boasts and Deep Drives, with an Emphasis on Counter-Dropping\nRest time between exercises: 1min30sec\nWARM-UP (10min)\n2min30sec: Boast – Drive – Drop – Drive (Sequence: Player A boasts → Player B drives → Player A drops → Player B drives)\n2min30sec: Boast – Drive 2 shots (keep same positions) (Sequence: Player A drives and then plays a boast (2 shots) → Player B drops and then plays a drives (2 shots)\nSwitch roles and repeat the exercises above\n\nSESSION\nCondition Game 1\nFirst to 7 points: Boast – Drive (rules: Player A plays boasts under the service line only. Player B plays drives behind the T-line)\nFirst to 7 points: Boast – Drive (rules: Player B plays boasts under the service line only. Player A plays drives behind the T-line)\n\nCondition Game 2\nFirst to 7 points: Boast – Drive with One Extra Drive (rules: Player A plays boasts under the service line only, but is allowed to play 1 straight drive per rally. Player B plays drives behind the T-line)\nFirst to 7 points: Boast – Drive with One Extra Drive (rules: Player B plays boasts under the service line only, but is allowed to play 1 straight drive per rally. Player A plays drives behind the T-line)\n\nCondition Game 3\nFirst to 9 points: Boast – Drive with One Counter (rules: Player A plays boasts under the service line only, but can counter drop if Player B plays a drop. Player B plays drives behind the T-line , but is allowed to play 1 counter drop per rally)\nFirst to 9 points: Boast – Drive with One Counter (rules: Player B plays boasts under the service line only,but can counter drop if Player A plays a drop. Player A plays drives behind the T-line, but is allowed to play 1 counter drop per rally)\n\nCondition Game 4\nFirst to 9 points:  Boast – Drive with Counters (rules: Player A plays boasts under the service line only, but can counter drop if Player B plays a drop. Player B can play a straight drive behind the line or counter drops)\nFirst to 9 points (both sides): Boast – Drive with Counters (rules: Player B plays boasts under the service line only,but can counter drop if Player A plays a drop. Player A can play a straight drive behind the line or counter drops\n\nCondition Game 5\nFirst to 11 points: Free Game (rules: if squeeze your opponent with a straight shot, i.e. the ball was too tight against the side wall, then you win 2 points)\n\nEnd of session."}
{"id": 6, "source": "Conditioned Games  Forehand Straight Game Using Different heights.docx", "type": "conditioned game", "participants": "2", "duration": "60min", "squashLevel": "Advanced", "fitness": "Medium", "intensity": "Medium", "primaryShots": ["counter drop", "straight drop", "volley straight drop", "deep drive", "hard drive", "straight drive", "straight kill", "straight lob", "volley drop"], "secondaryShots": ["counter drop", "straight drop", "volley straight drop", "deep drive", "hard drive", "straight drive", "straight kill", "straight lob", "volley drop"], "shots": ["drive", "lob", "drop", "boast", "volley", "kill"], "shotSide": ["forehand"], "contents": "Type: conditioned game\nParticipants: 2\nDuration: 60min\nIs_general: false\nPrimaryShots: straight drive, straight drop\nSecondaryShots: straight kill, straight drop, counter drop, straight lob\nShotTypes: volley, drive, lob, drop\nShotSide: forehand\nsquashLevel: Advanced\nIntensity: Medium\nFitness: Medium\n\nLeg workout: Medium\nArm workout: Medium\nSupport doc: Null\n\nFocus: Mastering Forehand Straight Game Strategy and Execution within Defined Frontwall Zones, specifically targeting different shot heights from low to high.\nRest time between exercises: 1min30sec\n\n\n\nWARM-UP (10min)\n2min30sec: Boast– Drive – Drop – Drive (Sequence: Player A boasts → Player B drives → Player A drops → Player B drives)\n2min30sec: Boast – Drive 2 shots (keep same positions) (Sequence: Player A drives and then plays a boast (2 shots) → Player B drops and then plays a drives (2 shots)\nSwitch roles and repeat the exercises above\n\nSESSION\nConditioned Game 1\nFirst to 7 points (forehand): Straight Drives (rules: Player A can play on Zone 1 and Zone 2. Player B can use Zone 2 and Zone 3)\nFirst to 7 points (forehand): Straight Drives (rules: Player A can play on Zone 2 and Zone 3. Player B can use Zone 1 and Zone 2)\n\nConditioned Game 2\nFirst to 7 points (forehand): Straight Drives with Volley Drop (rules: Both players can play on Zone 2 and Zone 3. Player A can play volley straight drop.  The response to the volley straight drop must be a straight lob)\nFirst to 7 points (forehand): Straight Drives with Volley Drop (rules: Both players can play on Zone 2 and Zone 3. Player B can play volley straight drop.  The response to the volley straight drop must be a straight lob)\nConditioned Game 3\nFirst to 7 points (forehand): Straight Drives with Drop (rules: Both players can play on Zone 2 and Zone 3. Player A can play straight drop if the ball bounced.  The response to the volley straight drop must be a straight lob)\nFirst to 7 points (forehand): Straight Drives with Drop (rules: Both players can play on Zone 2 and Zone 3. Player B can play straight drop if the ball bounced.  The response to the volley straight drop must be a straight lob)\nConditioned Game 4\nFirst to 7 points (forehand): Straight Drives with Drop and Counter (rules: Both players can play on Zone 2 and Zone 3. Player A can play straight drop if the ball bounced.  The response to the volley straight drop must be a straight lob or a counter drop)\nFirst to 7 points (forehand): Straight Drives with Drop and Counter (rules: Both players can play on Zone 2 and Zone 3. Player B can play straight drop if the ball bounced.  The response to the volley straight drop must be a straight lob or a counter drop)\nConditioned Game 5\nFirst to 11 points (forehand): Alley Game\nEnd of session.\n\nINSTRUCTIONS\nDefinition of Zones on the Front Wall – When you look at the front wall you could separate it into 3 different zones:\nThe bottom one (Zone 1) ⇒ Drop, kill, very hard drive area\nThe middle one (Zone 2) ⇒ Normal and deep drive area\nThe top one (Zone 3) ⇒ Lob area\n\n\n\n\n\n\n\n\n"}
{"id": 7, "source": "Conditioned Games - Open game versus halfcourt, straight and length games (intermediate).docx", "type": "conditioned game", "participants": "2", "duration": "60min", "squashLevel": "Intermediate", "fitness": "Medium", "intensity": "High", "primaryShots": ["2-wall boast", "3-wall boast", "cross drop", "straight drop", "deep drive", "hard drive", "straight drive", "straight kill", "cross lob", "deep cross", "cross deep", "hard cross", "straight lob"], "secondaryShots": ["2-wall boast", "3-wall boast", "cross drop", "straight drop", "deep drive", "hard drive", "straight drive", "straight kill", "cross lob", "deep cross", "cross deep", "hard cross", "straight lob"], "shots": ["drive", "cross", "lob", "drop", "boast", "volley", "kill"], "shotSide": ["forehand", "backhand"], "contents": "Type: conditioned game\nParticipants: 2\nDuration: 60min\nIs_general: true\nPrimaryShots: straight drive, straight drop, cross deep, cross drop, deep cross, deep drive\nSecondaryShots: 2-wall boast, 3-wall boast, straight kill, hard drive, hard cross, straight lob, cross lob\nShotTypes: volley, drive, cross, lob, drop, boast\nShotSide: forehand, backhand\nsquashLevel: Intermediate\nIntensity: High\nFitness: Medium\n\nLeg workout: High\nArm workout: Medium\nSupport doc: Null\n\nFocus: Developing strategic and technical skills required to consistently win rallies while operating under significant court and shot-type restrictions, against an opponent with full court access\nRest time between exercises: 1min30sec\n\n\n\n\nWARM-UP (10min)\n2min30sec: Boast– Drive – Drop – Drive (Sequence: Player A boasts → Player B drives → Player A drops → Player B drives)\n2min30sec: Boast – Drive 2 shots (keep same positions) (Sequence: Player A drives and then plays a boast (2 shots) → Player B drops and then plays a drives (2 shots)\nSwitch roles and repeat the exercises above\nSESSION\n\nConditioned Game 1\nFirst to 11 points: Open versus Halfcourt right side (rules: Player A can play everywhere. Player B is restricted to playing shots that land and stay within the right side of the court)\nFirst to 11 points: Open versus Halfcourt right side (rules: Player B can play everywhere. Player C is restricted to playing shots that land and stay within the right side of the court)\n\nConditioned Game 2\nFirst to 11 points: Open versus Halfcourt left side (rules: Player A can play everywhere. Player B is restricted to playing shots that land and stay within the left side of the court)\n\nFirst to 11 points: Open versus Halfcourt left side (rules: Player B can play everywhere. Player A is restricted to playing shots that land and stay within the left side of the court)\n\n\nConditioned Game 3\nFirst to 11 points: Open versus Straight Shots (rules: Player A can play everywhere. Player B is restricted to playing straight shots only)\nFirst to 11 points: Open versus Straight Shots (rules: Player B can play everywhere. Player A is restricted to playing straight shots only)\n\nConditioned Game 4\nFirst to 11 points: Open versus Back (rules: Player A can play everywhere. Player B is restricted to playing deep shots behind the T-line only)\nFirst to 11 points: Open versus Back (rules: Player B can play everywhere. Player A is restricted to playing deep shots behind the T-line only)\n\nEnd of session.\n\n\n\n\n\n\n\n"}
{"id": 8, "source": "Conditioned Game - 2-Wall Boast in front of opponent.docx", "type": "conditioned game", "participants": "2", "duration": "60min", "squashLevel": "Advanced", "fitness": "Medium", "intensity": "Medium", "primaryShots": ["2-wall boast", "trickle boast", "counter drop", "straight drop", "deep drive", "straight drive", "straight kill"], "secondaryShots": ["2-wall boast", "trickle boast", "counter drop", "straight drop", "deep drive", "straight drive", "straight kill"], "shots": ["drive", "cross", "drop", "boast", "kill"], "shotSide": ["forehand", "backhand"], "contents": "Type: conditioned game\nParticipants: 2\nDuration: 60min\nIs_general: false\nPrimaryShots: 2-wall boast\nSecondaryShots: trickle boast, straight drive, deep drive, straight kill, straight drop, counter drop\nShotTypes: boast\nShotSide: forehand, backhand\nsquashLevel: Advanced\nIntensity: Medium\nFitness: Medium\nIntensity: Medium\n\nLeg workout: Medium\nArm workout: Medium\nSupport doc: Null\n\nFocus: Mastering the 2-Wall Boast within a Driving Game\nRest time between exercises: 1min30sec\n\nWARM-UP (10min)\n2min30sec: Boast– Drive – Drop – Drive (Sequence: Player A boasts → Player B drives → Player A drops → Player B drives)\n2min30sec: Boast – Drive 2 shots (keep same positions) (Sequence: Player A drives and then plays a boast (2 shots) → Player B drops and then plays a drives (2 shots)\nSwitch roles and repeat the exercises above\nSESSION\n\nConditioned Game 1\nFirst to 7 points (forehand): Deep Drives (rules: first bounce of the ball on the floor must land behind the T-line)\nFirst to 7 points (backhand): Deep Drives (rules: first bounce of the ball on the floor must land behind the T-line)\nConditioned Game 2\nFirst to 9 points (forehand): Deep Drives with 2-Wall Boast (rules: first bounce of the ball on the floor must land behind the T-line. If you are in front of your opponent, you can play a boast. The response after the boast must be a deep cross)\nFirst to 9 points (backhand): Deep Drives with 2-Wall Boast (rules: first bounce of the ball on the floor must land behind the T-line. If you are in front of your opponent, you can play a 2-wall boast. The response after the boast must be a deep cross)\nConditioned Game 3\nFirst to 9 points (forehand): Alley Game with 2-Wall Boast (rules: first bounce of the ball on the floor must land behind the T-line. If you are in front of your opponent, you can play a 2-wall boast. The response after the boast must be a cross)\nFirst to 9 points (backhand): Alley Game with 2-Wall Boast (rules: first bounce of the ball on the floor must land behind the T-line. If you are in front of your opponent, you can play a 2-wall boast. The response after the boast must be a cross)\nConditioned Game 4\nFirst to 11 points (both sides): Length Game with 2-Wall Boast (rules: first bounce of the ball on the floor must land behind the T-line. If you are in front of your opponent, you can play a 2-wall boast. The response after the boast must be a deep shot)\nConditioned Game 5\nFirst to 11 points (both sides): Free Game (rules: If you win a rally with a 2-wall boast and you were in front of your opponent you get 2 points)\nEnd of session.\n\n\n\n\n"}
{"id": 9, "source": "Conditioned Game - Boast in front of opponent.docx", "type": "conditioned game", "participants": "2", "duration": "60min", "squashLevel": "Medium", "fitness": "Medium", "intensity": "Medium", "primaryShots": ["2-wall boast", "3-wall boast", "trickle boast", "counter drop", "straight drop", "deep drive", "straight drive", "straight kill"], "secondaryShots": ["2-wall boast", "3-wall boast", "trickle boast", "counter drop", "straight drop", "deep drive", "straight drive", "straight kill"], "shots": ["drive", "cross", "drop", "boast", "kill"], "shotSide": ["forehand", "backhand"], "contents": "Type: conditioned game\nParticipants: 2\nDuration: 60min\nIs_general: false\nPrimaryShots: 2-wall boast, 3-wall boast\nSecondaryShots: trickle boast, straight drive, deep drive, straight kill, straight drop, counter drop\nShotTypes: boast\nShotSide: forehand, backhand\nsquashLevel: Medium\nIntensity: Medium\nFitness: Medium\nIntensity: Medium\n\nLeg workout: Medium\nArm workout: Medium\nSupport doc: Null\n\nFocus: Strategic Application of Both 2-Wall and 3-Wall Boasts within a Driving Game\nRest time between exercises: 1min30sec\n\n\n\n\nWARM-UP (10min)\n2min30sec: Boast– Drive – Drop – Drive (Sequence: Player A boasts → Player B drives → Player A drops → Player B drives)\n2min30sec: Boast – Drive 2 shots (keep same positions) (Sequence: Player A drives and then plays a boast (2 shots) → Player B drops and then plays a drives (2 shots)\nSwitch roles and repeat the exercises above\nSESSION\n\nConditioned Game 1\nFirst to 7 points (forehand): Deep Drives (rules: first bounce of the ball on the floor must land behind the T-line)\nFirst to 7 points (backhand): Deep Drives (rules: first bounce of the ball on the floor must land behind the T-line)\nConditioned Game 2\nFirst to 9 points (forehand): Deep Drives with Boast (rules: first bounce of the ball on the floor must land behind the T-line. If you are in front of your opponent, you can play a boast. The response after the boast must be a deep cross)\nFirst to 9 points (backhand): Deep Drives with Boast (rules: first bounce of the ball on the floor must land behind the T-line. If you are in front of your opponent, you can play a boast. The response after the boast must be a deep cross)\nConditioned Game 3\nFirst to 9 points (forehand): Alley Game with Boast (rules: first bounce of the ball on the floor must land behind the T-line. If you are in front of your opponent, you can play a boast. The response after the boast must be a cross)\nFirst to 9 points (backhand): Alley Game with Boast (rules: first bounce of the ball on the floor must land behind the T-line. If you are in front of your opponent, you can play a boast. The response after the boast must be a cross)\nConditioned Game 4\nFirst to 11 points (both sides): Length Game with Boast (rules: first bounce of the ball on the floor must land behind the T-line. If you are in front of your opponent, you can play a boast. The response after the boast must be a deep shot)\nConditioned Game 5\nFirst to 11 points (both sides): Free Game (rules: If you win a rally with a boast and you were in front of your opponent you get 2 points)\nEnd of session.\n\n\n\n"}
{"id": 10, "source": "Drill - Defensive Cross Lob from the front.docx", "type": "drill", "participants": "2", "duration": "60min", "squashLevel": "Advanced", "fitness": "Medium", "intensity": "Medium", "primaryShots": ["straight drop", "straight drive", "cross lob", "lob cross", "deep cross", "cross deep"], "secondaryShots": ["straight drop", "straight drive", "cross lob", "lob cross", "deep cross", "cross deep"], "shots": ["lob"], "shotSide": ["forehand", "backhand"], "contents": "Type: drill\nParticipants: 2\nDuration: 60min\nSpecificShots: cross lob\nShots: lob\nShotSide: forehand, backhand\nsquashLevel: Advanced\nIntensity: Medium\nFitness: Medium\nIntensity: Medium\n\nLeg workout: Medium\nArm workout: Medium\nSupport doc: Null\n\nFocus: learn to use defensive cross lob to give yourself time to go back on the T\nRest time between exercises: 1min30sec\n\nWARM-UP (10min)\n2min30sec: Boast– Drive – Drop – Drive\n2min30sec: Boast – Drive 2 shots\nSwitch roles and repeat the exercises above\n\nSession\nExercise 1 (9min30sec)\n4min (forehand side): Boast – Cross 2 shots \nPlayer A: plays straight drive then boast\nPlayer B: plays straight drop then lob cross\n4min (forehand side, but switch roles): Boast – Cross Lob 2 shots\nPlayer A: plays straight drop then lob cross\nPlayer B: plays straight drive then boast\nExercise 2 (9min30sec)\n4min (backhand side): Boast – Cross Lob 2 shots\nPlayer A: plays straight drive then boast\nPlayer B: plays straight drop then lob cross\n4min (backhand side, but switch roles): Boast – cross lob 2 shots\nPlayer A: plays straight drop then lob cross\nPlayer B: plays straight drive then boast\nExercise 3 9min30sec)\n4min (forehand side): Boast – Cross with options from the back\nStart drill with a boast\nPlayer A (stays in the back only): boast or straight drive\nPlayer B responses: lob cross (if Player A played a boast) OR straight drive (if player A played a straight drive)\n4min (forehand side, but switch roles): Boast – Cross with options from the back\nExercise 4 (9min30sec)\n4min (backhand side): Boast – Cross with options from the back\nStart drill with a boast\nPlayer A (stays in the back only): boast or straight drive\nPlayer B responses: lob cross (if Player A played a boast) OR straight drive (if player A played a straight drive)\n4min (backhand side, but switch roles): Boast – Cross with options from the back (switch roles)\nExercise 5 (9min30sec)\n4min (forehand side) Boast – Cross with options\nStart drill with a boast\nFrom the back: both players can play a boast or a straight drive\nFrom the front: both players can play a straight drop or a lob cross\n4min (backhand side, same rules as above) Boast – Cross with options\nExercise 6 (optional)\nFirst to 15 points Free Game\nCondition: the response to any short shot has to be a cross lob\nWin 2 points if you win the rally with a Lob (winner or unforced error)\nEnd of session.\n"}
{"id": 11, "source": "Conditioned Games - Mix of Straight and Cross Lobs.docx", "type": "conditioned game", "participants": "2", "duration": "45min", "squashLevel": "Medium", "fitness": "Medium", "intensity": "Medium", "primaryShots": ["straight drop", "volley straight drop", "deep drive", "hard drive", "straight drive", "volley hard drive", "volley straight drive", "straight kill", "cross kill", "cross lob", "lob cross", "deep cross", "cross deep", "hard cross", "volley cross", "volley hard cross", "straight lob"], "secondaryShots": ["straight drop", "volley straight drop", "deep drive", "hard drive", "straight drive", "volley hard drive", "volley straight drive", "straight kill", "cross kill", "cross lob", "lob cross", "deep cross", "cross deep", "hard cross", "volley cross", "volley hard cross", "straight lob"], "shots": ["drive", "cross", "lob", "drop", "boast", "volley", "kill"], "shotSide": ["forehand", "backhand"], "contents": "Type: conditioned game\nParticipants: 2\nDuration: 45min\nIs_general: false\nPrimaryShots: cross lob, straight lob\nSecondaryShots: volley straight drive, volley cross, volley hard cross, volley hard drive, straight kill, cross kill, hard drive, hard cross, deep drive, deep cross, volley straight drop, straight lob, cross lob, straight drive\nShotTypes: volley, drive, cross, lob, drop, boast\nShotSide: forehand, backhand\nsquashLevel: Medium\nIntensity: Medium\nFitness: Medium\nIntensity: Medium\n\nLeg workout: Medium\nArm workout: Medium\nSupport doc: Null\n\nFocus: Mastering Lob-Based Rally Control. Employing Height (lob cross and straight lob) Strategically for Attack and Defense\nRest time between exercises: 1min30sec\n\n\nWARM-UP (10min)\n2min30sec: Boast– Drive – Drop – Drive (Sequence: Player A boasts → Player B drives → Player A drops → Player B drives)\n2min30sec: Boast – Drive 2 shots (keep same positions) (Sequence: Player A drives and then plays a boast (2 shots) → Player B drops and then plays a drives (2 shots)\nSwitch roles and repeat the exercises above\n\nWARM-UP (10min)\n2min30sec: Boast– Drive – Drop – Drive (Sequence: Player A boasts → Player B drives → Player A drops → Player B drives)\n2min30sec: Boast – Drive 2 shots (keep same positions) (Sequence: Player A drives and then plays a boast (2 shots) → Player B drops and then plays a drives (2 shots)\nSwitch roles and repeat the exercises above\n\nSESSION\nCondition Game 1\nFirst to 7 points (forehand): Drives (rules: ball must land in the alley and kills allowed)\nFirst to 7 points (backhand): Drives (rules: ball must land in the alley and kills allowed)\n\nCondition Game 2\nFirst to 9 points (both sides): Above The Service Line (rules: play every shot above the service line on the front wall)\n\nCondition Game 3\nFirst to 11 points (both sides): Alley Game with Lob Cross from the front\n\nCondition Game 4\nFirst to 11 points (both sides): Diagonal Game with Straight Lob from the front\n\nCondition Game 5\nFirst to 11 points: Free Game (rules: win 2 points if you win the rally with a Lob, i.e. winner or unforced error. Or win 2 points if you play a lob and win the rally with your \n\nEnd of session."}
{"id": 12, "source": "Conditioned Games - Length Game with Fast Volleys.docx", "type": "conditioned game", "participants": "2", "duration": "90min", "squashLevel": "Advanced", "fitness": "Medium", "intensity": "High", "primaryShots": ["counter drop", "cross drop", "straight drop", "volley cross drop", "volley straight drop", "deep drive", "hard drive", "straight drive", "volley hard drive", "volley straight drive", "hard cross", "volley cross", "volley hard cross"], "secondaryShots": ["counter drop", "cross drop", "straight drop", "volley cross drop", "volley straight drop", "deep drive", "hard drive", "straight drive", "volley hard drive", "volley straight drive", "hard cross", "volley cross", "volley hard cross"], "shots": ["drive", "cross", "lob", "drop", "boast", "volley", "kill"], "shotSide": ["forehand", "backhand"], "contents": "Type: conditioned game\nParticipants: 2\nDuration: 90min\nIs_general: true\nPrimaryShots: volley straight drop, deep drive, straight drop, counter drop, volley cross drop, volley straight drive, volley cross\nSecondaryShots: volley 2-wall,  volley hard cross, volley hard drive\nShotTypes: volley, drive, cross, lob, drop, boast\nShotSide: forehand, backhand\nsquashLevel: Advanced\nIntensity: High\nFitness: Medium\n\nLeg workout: Medium\nArm workout: Medium\nSupport doc: Null\n\nFocus: Mastering Proactive Volley Play to Control the T and Dominate the Front Court\nRest time between exercises: 1min30sec\n\n\n\n\nWARM-UP (10min)\n2min30sec: Boast– Drive – Drop – Drive (Sequence: Player A boasts → Player B drives → Player A drops → Player B drives)\n2min30sec: Boast – Drive 2 shots (keep same positions) (Sequence: Player A drives and then plays a boast (2 shots) → Player B drops and then plays a drives (2 shots)\nSwitch roles and repeat the exercises above\n\nSESSION\nConditioned Game 1\nFirst to 9 points (both sides): Length Game with Kills (rules: second bounce of the ball on the floor must land behind the T-line.)\nConditioned Game 2\nFirst to 9 points (both sides): Length Game with Kills and Volley Straight Drop (rules: second bounce of the ball on the floor must land behind the T-line. If a player volleys around the T-line then this player is allowed to play a volley straight drop)\nConditioned Game 3\nFirst to 9 points (both sides): Length Game with Kills and any Volley Short (rules: second bounce of the ball on the floor must land behind the T-line. If a player volleys around the T-line then this player is allowed to play a volley short shots(e.g. volley drops and boasts)\nConditioned Game 4\nFirst to 9 points (both sides): Length Game with Kills and Deep Shot Focus (rules: second bounce of the ball on the floor must land behind the T-line. If a player plays 2 deep drives in a rally, i.e. ball bouncing on the floor then backglass, then the rally is automatically won)\nFirst to 9 points (both sides): Length Game with Kills and Short After Deep (rules: second bounce of the ball on the floor must land behind the T-line. If a player plays a deep drive, i.e. ball bouncing on the floor then backglass, then the opponent must play a short shot. Counters are allowed)\nConditioned Game 5\nFirst to 11 points (both sides): Free Game\n\nEnd of session\n\nINSTRUCTIONS\nAdvice: Here you are expected to be smart and use combinations of shots. Without combinations the efficiency of these exercises will not be maximised. If you are unsure about the combinations you could try to do… contact your coaches :-) \nKills: all length games are with kill allowed (2nd bounce behind the line)\nCounters: Any short shots can be countered as many as the players want until someone plays a deep shot, unless specified otherwise\n \n\n\n\n"}
{"id": 13, "source": "Conditioned Games - Open game versus restricted halfcourt, alley and length games (advanced).docx", "type": "conditioned game", "participants": "2", "duration": "60min", "squashLevel": "Advanced", "fitness": "Medium", "intensity": "High", "primaryShots": ["2-wall boast", "3-wall boast", "cross drop", "straight drop", "deep drive", "hard drive", "straight drive", "straight kill", "cross lob", "deep cross", "cross deep", "hard cross", "straight lob"], "secondaryShots": ["2-wall boast", "3-wall boast", "cross drop", "straight drop", "deep drive", "hard drive", "straight drive", "straight kill", "cross lob", "deep cross", "cross deep", "hard cross", "straight lob"], "shots": ["drive", "cross", "lob", "drop", "boast", "volley", "kill"], "shotSide": ["forehand", "backhand"], "contents": "Type: conditioned game\nParticipants: 2\nDuration: 60min\nIs_general: true\nPrimaryShots: straight drive, straight drop, cross deep, cross drop, deep cross, deep drive\nSecondaryShots: 2-wall boast, 3-wall boast, straight kill, hard drive, hard cross, straight lob, cross lob\nShotTypes: volley, drive, cross, lob, drop, boast\nShotSide: forehand, backhand\nsquashLevel: Advanced\nIntensity: High\nFitness: Medium\n\nLeg workout: High\nArm workout: Medium\nSupport doc: Null\n\nFocus: Developing advanced strategic and technical skills required to consistently win rallies while operating under significant court and shot-type restrictions, against an opponent with full court access\n\nRest time between exercises: 1min30sec\n\nWARM-UP (10min)\n2min30sec: Boast– Drive – Drop – Drive (Sequence: Player A boasts → Player B drives → Player A drops → Player B drives)\n2min30sec: Boast – Drive 2 shots (keep same positions) (Sequence: Player A drives and then plays a boast (2 shots) → Player B drops and then plays a drives (2 shots)\nSwitch roles and repeat the exercises above\nSESSION\n\nConditioned Game 1\nFirst to 11 points: Open versus Halfcourt right side (rules: Player A can play everywhere. Player B is restricted to playing shots that land and stay within the right side of the court. If Player B plays a straight shot, it must be in the alley)\nFirst to 11 points: Open versus Halfcourt right side (rules: Player B can play everywhere. Player A is restricted to playing shots that land and stay within the right side of the court. If Player A plays a straight shot, it must be in the alley)\n\nConditioned Game 2\nFirst to 11 points: Open versus Halfcourt left side (rules: Player A can play everywhere. Player B is restricted to playing shots that land and stay within the left side of the court. If Player B plays a straight shot, it must be in the alley)\n\nFirst to 11 points: Open versus Halfcourt left side (rules: Player B can play everywhere. Player A is restricted to playing shots that land and stay within the left side of the court. If Player A plays a straight shot, it must be in the alley)\n\nConditioned Game 3\nFirst to 11 points: Open versus Alley Game (rules: Player A can play everywhere. Player B is restricted to playing shots that land and stay within the alley of the right side of the court)\n\nFirst to 11 points: Open versus Alley Game (rules: Player B can play everywhere. Player A is restricted to playing straight shots only)\n\nConditioned Game 4\nFirst to 11 points: Open versus Back (rules: Player A can play everywhere. Player B is restricted to playing deep shots behind the T-line only)\nFirst to 11 points: Open versus Back (rules: Player B can play everywhere. Player A is restricted to playing deep shots behind the T-line only)\n\nEnd of session.\n\n\n\n\n\n\n\n\n"}
{"id": 14, "source": "Drill – Dealing With Crosses.docx", "type": "drill", "participants": "2", "duration": "45min", "squashLevel": "Advanced", "fitness": "Medium", "intensity": "Medium", "primaryShots": ["deep drive", "straight drive", "volley deep drive", "cross lob", "deep cross", "cross deep", "hard cross", "volley drive"], "secondaryShots": ["deep drive", "straight drive", "volley deep drive", "cross lob", "deep cross", "cross deep", "hard cross", "volley drive"], "shots": ["volley", "cross"], "shotSide": ["forehand", "backhand"], "contents": "Type: drill\nParticipants: 2\nDuration: 45min\nSpecificShots: volley straight\nShots: volley, cross\nShotSide: forehand, backhand\nsquashLevel: Advanced\nIntensity: Medium\nFitness: Medium\nIntensity: Medium\n\nLeg workout: Medium\nArm workout: Medium\nSupport doc: Null\n\n\nFocus: learn to play in the diagonals using volleys to counter mid or high crosses\nRest time between exercises: 1min30sec\nWARM-UP (10min)\n2min30sec: Boast – Drive – Drop – Drive\n2min30sec: Boast – Cross – Boast – Drive\nSwitch roles and repeat the exercises above\nSESSION\nExercise 1 (7min30sec)\n3min (forehand side): Boast – Cross 2 shots \n3min (forehand side): Boast – Cross 2 shots (switch roles)\nExercise 2 (7min30sec)\n3min (forehand side): Boast – BH Cross Lob – FH Soft Volley Deep Drive (Sequence)\n3min (backhand side): Boast – FH Cross Lob – BH Soft Volley Deep Drive (Sequence)\nExercise 3 (7min30sec)\n3min (forehand side): Boast – BH Cross Lob – FH Hard Volley Drive (Sequence)\n3min (backhand side): Boast – FH Cross Lob – BH Hard Volley Drive (Sequence)\nExercise 4 (7min30sec)\n3min (forehand side): Boast – BH Hard Cross – FH Volley Drive (Sequence)\n3min (backhand side): Boast – FH Hard Cross – BH Volley Drive (Sequence)\n\nExercise 5 (optional)\n11points (forehand side): Boast – BH Cross – FH Straight Drive (Sequence – with serve, returner’s defines the start of the sequence)\n11points (backhand side): Boast – FH Cross – BH Straight Drive (Sequence – with serve, returner’s defines the start of the sequence)\n\n\n\n"}
{"id": 15, "source": "Conditioned Games - Diagonals with counters and additional straight drive.docx", "type": "conditioned game", "participants": "2", "duration": "60min", "squashLevel": "Medium", "fitness": "Medium", "intensity": "Medium", "primaryShots": ["2-wall boast", "3-wall boast", "counter drop", "hard drive", "straight drive", "volley straight drive", "cross kill", "cross wide", "wide cross"], "secondaryShots": ["2-wall boast", "3-wall boast", "counter drop", "hard drive", "straight drive", "volley straight drive", "cross kill", "cross wide", "wide cross"], "shots": ["drive", "cross", "lob", "drop", "boast", "volley", "kill"], "shotSide": ["forehand", "backhand"], "contents": "Type: conditioned game\nParticipants: 2\nDuration: 60min\nIs_general: false\nPrimaryShots: volley straight drive, cross deep, counter drop, 2-wall boast, 3-wall boast\nSecondaryShots: straight drive, hard drive, cross wide, cross kill\nShotTypes: drive, drop, cross, volley, lob\nShotSide: forehand, backhand\nsquashLevel: Medium\nIntensity: Medium\nFitness: Medium\nIntensity: Medium\n\nLeg workout: Medium\nArm workout: Medium\nSupport doc: Null\n\nFocus: Mastering the Boast-Cross-Drive Rally Pattern to Force Maximum Diagonal Court Coverage and Strategic Cross-Court Volley Interception\nRest time between exercises: 1min30sec\n\nWARM-UP (10min)\n2min30sec: Boast– Drive – Drop – Drive (Sequence: Player A boasts → Player B drives → Player A drops → Player B drives)\n2min30sec: Boast – Drive 2 shots (keep same positions) (Sequence: Player A drives and then plays a boast (2 shots) → Player B drops and then plays a drives (2 shots)\nSwitch roles and repeat the exercises above\nSESSION\n\nConditioned Game 1\nFirst to 9 points (forehand): Boast – Cross – Drive (rules: you must follow the pattern/sequence. Kills are allowed for deep shots)\nFirst to 9 points (backhand): Boast – Cross – Drive (rules: you must follow the pattern/sequence. Kills are allowed for deep shots)\n\n\nConditioned Game 2\nFirst to 9 points (forehand): Boast – Cross – Drive with Counters (rules: You must follow the pattern/sequence Boast – Cross – Drive. Kills are allowed for deep shots. After a boast players can counter straight as many times as they want until someone plays the cross)\nFirst to 9 points (backhand): Boast – Cross – Drive with Counters (rules: You must follow the pattern/sequence Boast – Cross – Drive. Kills are allowed for deep shots. After a boast players can counter straight as many times as they want until someone plays the cross)\n\nConditioned Game 3\nFirst to 9 points (forehand): Boast – Cross – Drive with Counters & 1 Additional Drive (rules: You must follow the pattern/sequence Boast – Cross – Drive. Kills are allowed for deep shots. After a boast players can counter straight as many times as they want until someone plays the cross. 1 time per rally you can break the pattern with an additional drive)\nFirst to 9 points (backhand): Boast – Cross – Drive with Counters & 1 Additional Drive (rules: You must follow the pattern/sequence Boast – Cross – Drive. Kills are allowed for deep shots. After a boast players can counter straight as many times as they want until someone plays the cross. 1 time per rally you can break the pattern with an additional drive)\nConditioned Game 4\nFirst to 11 points (forehand): Diagonale Game (rules: the ball first bounce must land in the designated areas)\nFirst to 11 points (backhand): Diagonale Game (rules: the ball first bounce must land in the designated areas) \n\nEnd of session."}
{"id": 16, "source": "Conditioned Games - Mixed games for beginners.docx", "type": "conditioned game", "participants": "2", "duration": "60min", "squashLevel": "Beginner", "fitness": "Medium", "intensity": "Medium", "primaryShots": ["cross drop", "straight drop", "volley cross drop", "hard drive", "straight drive", "volley straight drive", "cross lob", "deep cross", "cross deep", "hard cross", "volley cross", "straight lob"], "secondaryShots": ["cross drop", "straight drop", "volley cross drop", "hard drive", "straight drive", "volley straight drive", "cross lob", "deep cross", "cross deep", "hard cross", "volley cross", "straight lob"], "shots": ["drive", "cross", "lob", "drop", "boast", "volley"], "shotSide": ["forehand", "backhand"], "contents": "Type: conditioned game\nParticipants: 2\nDuration: 60min\nIs_general: true\nPrimaryShots: straight drive, deep cross, straight drop \nSecondaryShots: volley straight drive, volley cross drop, hard drive, hard cross, straight lob, cross lob\nShotTypes: volley, drive, cross, lob, drop\nShotSide: forehand, backhand\nsquashLevel: Beginner\nIntensity: Medium\nFitness: Medium\n\nLeg workout: Medium\nArm workout: Medium\nSupport doc: Null\n\nFocus: Mastering Foundational Depth, Height, and Halfcourt Control for Beginner Rally Consistency\nRest time between exercises: 1min30sec\n\n\nWARM-UP (10min)\n2min30sec: Boast– Drive – Drop – Drive (Sequence: Player A boasts → Player B drives → Player A drops → Player B drives)\n2min30sec: Boast – Drive 2 shots (keep same positions) (Sequence: Player A drives and then plays a boast (2 shots) → Player B drops and then plays a drives (2 shots)\nSwitch roles and repeat the exercises above\nSESSION\n\nConditioned Game 1\nFirst to 11 points (forehand): Drives (rules: ball second bounce must land behind the line)\nFirst to 11 points (backhand): Drives (rules: ball second bounce must land behind the line)\n\nConditioned Game 2\nFirst to 11 points (both sides): Length Game (rules: ball second bounce must land behind the line)\n\nConditioned Game 2\nFirst to 11 points (both sides): Length Game (rules: ball second bounce must land behind the line)\n\nConditioned Game 3\nFirst to 11 points (both sides): Above The Service Line (rules: play every shot above the service line on the front wall)\n\nConditioned Game 4\nFirst to 11 points (forehand): Forehand Side  (rules: Half court. Play only on the right side of the court, short or long)\nFirst to 11 points (backhand): Backhand Side (rules: Half court. Play only on the left side of the court, short or long)\n\nCondition Game 5\nFirst to 11 points: Free Game \n\nEnd of session.\n"}
{"id": 17, "source": "Conditioned Games - Drives and Straight kills with 1 boast or straight drop attacking options.docx", "type": "conditioned game", "participants": "2", "duration": "60min", "squashLevel": "Medium", "fitness": "Medium", "intensity": "Medium", "primaryShots": ["straight drop", "volley straight drop", "deep drive", "hard drive", "straight drive"], "secondaryShots": ["straight drop", "volley straight drop", "deep drive", "hard drive", "straight drive"], "shots": ["drive", "cross", "drop", "boast", "volley"], "shotSide": ["forehand", "backhand"], "contents": "Type: conditioned game\nParticipants: 2\nDuration: 60min\nIs_general: false\nPrimaryShots: straight drive, straight drop, 2-wall, 3-wall\nSecondaryShots: hard drive, straight kills, deep drive \nShotTypes: drive, drop, volley, boast\nShotSide: forehand, backhand\nsquashLevel: Medium\nIntensity: Medium\nFitness: Medium\nIntensity: Medium\n\nLeg workout: Medium\nArm workout: Medium\nSupport doc: Null\n\nFocus: Mastering straight game to create opportunities to attack using a boast or volley straight drop.\nRest time between exercises: 1min30sec\n\nWARM-UP (10min)\n2min30sec: Boast– Drive – Drop – Drive (Sequence: Player A boasts → Player B drives → Player A drops → Player B drives)\n2min30sec: Boast – Drive 2 shots (keep same positions) (Sequence: Player A drives and then plays a boast (2 shots) → Player B drops and then plays a drives (2 shots)\nSwitch roles and repeat the exercises above\nSESSION\nConditioned Game 1 (deep only)\nFirst to 7 points (forehand): Deep Drives (rules: first bounce of the ball on the floor must land behind the T-line)\nFirst to 7 points (backhand): Deep Drives (rules: first bounce of the ball on the floor must land behind the T-line)\nConditioned Game 2\nFirst to 9 points (forehand): Drives with 1 Straight Drop (rules: 2nd bounce of the ball on the floor must land behind the T-line. Each player can play a straight drop off the bounce one time per rally. The response after the drop must be a deep straight)\nFirst to 9 points (backhand):  Drives with 1 Straight Drop (rules: 2nd bounce of the ball on the floor must land behind the T-line. Each player can play a straight drop off the bounce one time per rally. The response after the drop must be a deep straight)\n\nConditioned Game 3\nFirst to 7 points (forehand): Drives with 1 Boast (rules: second bounce of the ball on the floor must land behind the T-line. Each player can play a boast off the bounce one time per rally. The response after the drop must be a deep cross)\nFirst to 7 points (backhand): Drives with 1 Boast (rules: second bounce of the ball on the floor must land behind the T-line. Each player can play a boast off the bounce one time per rally. The response after the drop must be a deep cross)\n\nConditioned Game 4\nFirst to 7 points (forehand): Drives with 1 Volley Straight Drop (rules: second bounce of the ball on the floor must land behind the T-line. Each player can play a volley straight drop per rally. The response after the drop must be a deep straight)\nFirst to 7 points (backhand): Drives with 1 Volley Straight Drop (rules: second bounce of the ball on the floor must land behind the T-line. Each player can play a volley straight drop per rally. The response after the drop must be a deep straight)\n\nConditioned Game 5\nFirst to 11 points: Free Game\n\nEnd of session.\n\n\n\n\n\n\n"}
{"id": 18, "source": "Conditioned Games - Cross, Halfcourt and Diagonal Game.docx", "type": "conditioned game", "participants": "2", "duration": "60min", "squashLevel": "Beginner", "fitness": "Medium", "intensity": "Medium", "primaryShots": ["counter drop", "cross drop", "deep drive", "hard drive", "straight kill", "cross kill", "cross lob", "deep cross", "cross deep", "straight lob"], "secondaryShots": ["counter drop", "cross drop", "deep drive", "hard drive", "straight kill", "cross kill", "cross lob", "deep cross", "cross deep", "straight lob"], "shots": ["drive", "cross", "lob", "drop", "boast", "volley", "kill"], "shotSide": ["forehand", "backhand"], "contents": "Type: conditioned game\nParticipants: 2\nDuration: 60min\nIs_general: true\nPrimaryShots: null\nSecondaryShots: deep drive, hard drive, straight lob,  straight kill, deep cross,  cross kill, cross lob, counter drop, cross drop, wide cross\nShotTypes: drive, drop, cross, volley, lob\nShotSide: forehand, backhand\nsquashLevel: Beginner\nIntensity: Medium\nFitness: Medium\nIntensity: Medium\n\nLeg workout: Medium\nArm workout: Medium\nSupport doc: Null\n\nFocus: Developing Foundational Shot Placement and Court Spatial Awareness through Zonal Play.\nRest time between exercises: 1min30sec\n\nWARM-UP (10min)\n2min30sec: Boast– Drive – Drop – Drive (Sequence: Player A boasts → Player B drives → Player A drops → Player B drives)\n2min30sec: Boast – Drive 2 shots (keep same positions) (Sequence: Player A drives and then plays a boast (2 shots) → Player B drops and then plays a drives (2 shots)\nSwitch roles and repeat the exercises above\n\nSESSION\nCondition Game 1\nFirst to 11 points: Cross Game (rules: Player A is restricted to playing shots that land and stay within the right side of the court. Player B is restricted to playing shots that land and stay within the left side of the court.)\nFirst to 11 points: Cross Game (rules: Player B is restricted to playing shots that land and stay within the right side of the court. Player A is restricted to playing shots that land and stay within the left side of the court.)\n\nCondition Game 2\nFirst to 11 points (forehand): Halfcourt\nFirst to 11 points (backhand): Halfcourt\n\nCondition Game 3\nFirst to 11 points (forehand): Diagonal Game\nFirst to 11 points (backhand): Diagonal Game\n\nCondition Game 4\nFirst to 11 points: Free Game\nFirst to 11 points: Free Game\n\nEnd of session.\n\n"}
{"id": 19, "source": "Mix - Straight Drive from the front & Front court Movement (Intermediate) .docx", "type": "mix", "participants": "2", "duration": "45min", "squashLevel": "Intermediate", "fitness": "Medium", "intensity": "Medium", "primaryShots": ["straight drive", "3-step ghosting"], "secondaryShots": ["straight drive", "3-step ghosting"], "shots": ["drive"], "shotSide": ["forehand", "backhand"], "contents": "Type: mix\nParticipants: 2\nDuration: 45min\nSpecifiShots: straight drive, 3-step ghosting\nShots: drive\nShotSide: forehand, backhand\nMovement: front\nsquashLevel: Intermediate\nIntensity: Medium\nFitness: Medium\nIntensity: Medium\n\nLeg workout: High\nArm workout: Medium\nSupport doc: Null\n\n\nFocus: master your straight drives from the front & front court movement.\nRest time between exercises: 1min30sec\n\nInstructions: \nStraight drive technique: when hitting your straight drive, face the side wall. Avoid facing the front wall during your shot or when ghosting. Ask your coach for more tips. \nGhosting routine: all ghosting routines focus on the front corners. Each ghost to the corner should be a 3-step movement, finishing with a lunge. Aim to return to the T in 3 steps as well.\n\nWARM-UP (5min)\n4min: Boast–Drive (Switch roles halfway)\nSequence: Player A boasts → Player B drives → Player A boasts → Player B drives\n\nSESSION\nExercise 1 (9min30sec)\n2x4min (forehand side): Drop - Drive (Switch roles halfway)\nPlayer A: feeds straight drops from the back\nPlayer B: plays straight drives (first bounce behind the service box)\nOptional Target: Place a small target (e.g. wristband, a shoe, or even a ball box) on the floor, 10 to 30cm behind the service box and against the side wall. The smaller the target, the more challenging it will be! Your goal is to consistently land the first bounce of your drive directly on it. \nExercise 2 (9min30sec)\n4min (backhand side): Drop – Drive (half-time players change roles)\nPlayer A: feeds straight drops from the back\nPlayer B: plays straight drives (first bounce behind the service box)\nOptional Target: Place a small target (e.g. wristband, a shoe, or even a ball box) on the floor, 10 to 30cm behind the service box and against the side wall. The smaller the target, the more challenging it will be! Your goal is to consistently land the first bounce of your drive directly on it. \nExercise 3 (9min30sec)\n4x2min (forehand side): Drop – FH Drive – BH Ghost (half-time players change roles)\nSequence: Player A drops to the front right corner → Player B ghosts to the front left corner, then returns to the T → Player A feeds the next drop once B is back on the T.\nPlayer A: feeds straight drops only\nPlayer B: plays straight drives (first bounce behind the service box) from the front then ghosts to the opposite corner in the front\nOptional Target: Place a small target (e.g. wristband, a shoe, or even a ball box) on the floor, 10 to 30cm behind the service box and against the side wall\n\nExercise 4 (9min30sec)\n2x4min (forehand side): Drop/Boast – Drive (half-time players change roles)\nPlayer A: feeds straight drops or boast from the back\nPlayer B: plays straight drives only (first bounce behind the service box)\nOptional Target: Place a small target (e.g. wristband, a shoe, or even a ball box) on the floor, 10 to 30cm behind the service boxes and against the side walls\n\n\n"}
{"id": 20, "source": "Conditioned Games - Length games with volley short and counters.docx", "type": "conditioned game", "participants": "2", "duration": "60min", "squashLevel": "Medium", "fitness": "Medium", "intensity": "Medium", "primaryShots": ["2-wall boast", "volley 2-wall boast", "counter drop", "cross drop", "straight drop", "volley cross drop", "volley straight drop", "deep drive", "hard drive", "straight drive", "volley hard drive", "volley straight drive", "straight kill", "cross kill", "hard cross", "volley cross", "volley hard cross"], "secondaryShots": ["2-wall boast", "volley 2-wall boast", "counter drop", "cross drop", "straight drop", "volley cross drop", "volley straight drop", "deep drive", "hard drive", "straight drive", "volley hard drive", "volley straight drive", "straight kill", "cross kill", "hard cross", "volley cross", "volley hard cross"], "shots": ["drive", "cross", "lob", "drop", "boast", "volley", "kill"], "shotSide": ["forehand", "backhand"], "contents": "Type: conditioned game\nParticipants: 2\nDuration: 60min\nIs_general: true\nPrimaryShots: volley straight drop, counter drop, volley cross drop, volley 2-wall boast,\nSecondaryShots: volley straight drive, volley cross, volley hard cross, volley hard drive, straight kill, cross kill, hard drive, hard cross, deep drive, deep cross\nShotTypes: volley, drive, cross, lob, drop, boast\nShotSide: forehand, backhand\nsquashLevel: Medium\nIntensity: Medium\nFitness: Medium\n\nLeg workout: Medium\nArm workout: Medium\nSupport doc: Null\n\nFocus: Mastering Deep Court Control, Strategic Volley Short Play, and Effective Counter-Dropping for Rally Dominance\nRest time between exercises: 1min30sec\n\n\nWARM-UP (10min)\n2min30sec: Boast– Drive – Drop – Drive (Sequence: Player A boasts → Player B drives → Player A drops → Player B drives)\n2min30sec: Boast – Drive 2 shots (keep same positions) (Sequence: Player A drives and then plays a boast (2 shots) → Player B drops and then plays a drives (2 shots)\nSwitch roles and repeat the exercises above\nSESSION\n\nConditioned Game 1\nFirst to 9 points (both sides): Length Game (rules: ball first bounce must land behind the line)\nFirst to 9 points (both sides): Length Game with Kills (rules: ball second bounce must land behind the line)\n\nConditioned Game 2 (deep only)\nFirst to 9 points (both sides): Length Game with Volley Straight Drop (rules: ball first bounce must land behind the line. Players can play volley straight drops. The response to a straight shot must be a deep shot )\nFirst to 9 points (both sides): Length Game with Volley Straight Drop+ (rules: ball first bounce must land behind the line. If a player is in front of their opponent, a volley straight drop can be played. The response to a straight shot must be a deep shot ) \n\nConditioned Game 3 (kill allowed)\nFirst to 9 points (both sides): Length Game with Volley Short & Counter (rules: ball second bounce must land behind the line. If a player is in front of their opponent, any volley short can be played. The response to a straight shot can be a 1 counter drop or a deep shot )\nFirst to 9 points (both sides): Length Game with Volley Short & Counters (rules: ball second bounce must land behind the line. If a player is in front of their opponent, any volley short can be played. The response to a straight shot can be as many counter drops until someone plays a deep shot )\n\nConditioned Game 4\nFirst to 11 points: Free Game (rules: if you play a cross or a drive to the back and manage to force a boast from the back and win the rally, you get 2 points)\nEnd of session.\n\n"}
{"id": 21, "source": "Conditioned Game - Front versus Back with emphasis on volley straight drive and counter.docx", "type": "conditioned game", "participants": "2", "duration": "45min", "squashLevel": "Advanced", "fitness": "Medium", "intensity": "High", "primaryShots": ["counter drop", "cross drop", "straight drop", "straight drive", "volley straight drive", "straight kill", "cross kill", "cross lob", "deep cross", "cross deep", "cross wide", "wide cross", "straight lob", "volley drive"], "secondaryShots": ["counter drop", "cross drop", "straight drop", "straight drive", "volley straight drive", "straight kill", "cross kill", "cross lob", "deep cross", "cross deep", "cross wide", "wide cross", "straight lob", "volley drive"], "shots": ["drive", "cross", "lob", "drop", "boast", "volley", "kill"], "shotSide": ["forehand", "backhand"], "contents": "Type: conditioned game\nParticipants: 2\nDuration: 45min\nIs_general: true\nPrimaryShots: volley straight drive, counter drop\nSecondaryShots: straight kill, cross kill, straight drive, straight drop, cross drop, cross lob, straight lob, cross wide, cross deep\nShotTypes: volley, drive, cross, lob, drop, boast\nShotSide: forehand, backhand\nsquashLevel: Advanced\nIntensity: High\nFitness: Medium\n\nLeg workout: High\nArm workout: Medium\nSupport doc: Null\n\nFocus: Mastering high variations of deep shots from the front of the court and high variations of short shots from the back of the court. Mastering Dynamic Role Reversal via Volley Straight Interception and Strategic Counter-Dropping\nRest time between exercises: 1min30sec\n\n\nWARM-UP (10min)\n2min30sec: Boast– Drive – Drop – Drive (Sequence: Player A boasts → Player B drives → Player A drops → Player B drives)\n2min30sec: Boast – Drive 2 shots (keep same positions) (Sequence: Player A drives and then plays a boast (2 shots) → Player B drops and then plays a drives (2 shots)\nSwitch roles and repeat the exercises above\n\nSESSION\nConditioned Game 1\nFirst to 9 points (forehand): Front versus Back with Kills (rules: Player A must play every shot second bounce behind the line. Player B must play only short soft shots, i.e. boasts and drops)\nFirst to 9 points (backhand): Front versus Back with Kills (rules: Player B must play every shot second bounce behind the line. Player A must play only short soft shots, i.e. boasts and drops)\n\nConditioned Game 2\nFirst to 11 points: Front versus Back with Kills and Volley Drive (rules: Player A must play every shot second bounce behind the line. Player B must play only short soft shots, i.e. boasts and drops. However, if Player B manages to volley, a volley straight drive can be played and both players change roles until the person in the back decides to play a volley straight drive again or the rally is over. Every rally you change the player starting at the back)\nFirst to 11 points: Front versus Back with Kills and Volley Drive (rules: Player B must play every shot second bounce behind the line. Player A must play only short soft shots, i.e. boasts and drops. However, if Player A manages to volley, a volley straight drive can be played and both players change roles until the person in the back decides to play a volley straight drive again or the rally is over. Every rally you change the player starting at the back)\n\nConditioned Game 3\nFirst to 9 points: Front versus Back with Kills with One Counter (rules: Player A must play every shot second bounce behind the line. Once per rally Player A can play a straight counter drop. Player B must play only short soft shots, i.e. boasts and drops)\nFirst to 9 points: Front versus Back with Kills with One Counter (rules: Player B must play every shot second bounce behind the line. Once per rally Player B can play a straight counter drop. Player A must play only short soft shots, i.e. boasts and drops)\n\n\nEnd of session.\n\n\n\n\n\n\n\n\n"}
{"id": 22, "source": "Conditioned Games - Mixed games for intermediate.docx", "type": "conditioned game", "participants": "2", "duration": "60min", "squashLevel": "Beginner", "fitness": "Medium", "intensity": "Medium", "primaryShots": ["cross drop", "straight drop", "volley cross drop", "hard drive", "straight drive", "volley straight drive", "straight kill", "cross kill", "hard cross", "volley cross", "straight lob"], "secondaryShots": ["cross drop", "straight drop", "volley cross drop", "hard drive", "straight drive", "volley straight drive", "straight kill", "cross kill", "hard cross", "volley cross", "straight lob"], "shots": ["drive", "cross", "lob", "drop", "boast", "volley", "kill"], "shotSide": ["forehand", "backhand"], "contents": "Type: conditioned game\nParticipants: 2\nDuration: 60min\nIs_general: true\nPrimaryShots: straight drive, deep cross, straight drop, straight kill, cross kill \nSecondaryShots: volley straight drive, volley cross drop, hard drive, hard cross, straight lob\nShotTypes: volley, drive, cross, lob, drop\nShotSide: forehand, backhand\nsquashLevel: Beginner\nIntensity: Medium\nFitness: Medium\n\nLeg workout: Medium\nArm workout: Medium\nSupport doc: Null\n\nFocus: Mastering Foundational Depth, Height, and Alley Control for Beginner/Intermediate Rally Consistency\nRest time between exercises: 1min30sec\n\nWARM-UP (10min)\n2min30sec: Boast– Drive – Drop – Drive (Sequence: Player A boasts → Player B drives → Player A drops → Player B drives)\n2min30sec: Boast – Drive 2 shots (keep same positions) (Sequence: Player A drives and then plays a boast (2 shots) → Player B drops and then plays a drives (2 shots)\nSwitch roles and repeat the exercises above\nSESSION\n\nConditioned Game 1\nFirst to 11 points (forehand): Drives (rules: ball first bounce must land behind the line)\nFirst to 11 points (backhand): Drives (rules: ball first bounce must land behind the line)\n\nConditioned Game 2\nFirst to 11 points (both sides): Length Game (rules: ball second bounce must land behind the line)\n\nConditioned Game 2\nFirst to 11 points (both sides): Length Game (rules: ball first bounce must land behind the line)\n\nConditioned Game 3\nFirst to 11 points (both sides): Above The Service Line (rules: play every shot above the service line on the front wall)\n\nConditioned Game 4\nFirst to 11 points (forehand): Alley Game  (rules: Play only on the right side of the court, short or long, but in the alley delimited by the service box)\nFirst to 11 points (backhand): Alley Game (rules: Play only on the left side of the court, short or long, but in the alley delimited by the service box)\n\nCondition Game 5\nFirst to 11 points: Free Game\nEnd of session.\n\n"}
{"id": 23, "source": "Conditioned Games - Cross versus Straight.docx", "type": "conditioned game", "participants": "2", "duration": "60min", "squashLevel": "Advanced", "fitness": "Medium", "intensity": "High", "primaryShots": ["counter drop", "cross drop", "deep drive", "hard drive", "straight kill", "cross kill", "cross lob", "deep cross", "cross deep", "straight lob"], "secondaryShots": ["counter drop", "cross drop", "deep drive", "hard drive", "straight kill", "cross kill", "cross lob", "deep cross", "cross deep", "straight lob"], "shots": ["drive", "cross", "lob", "drop", "boast", "volley", "kill"], "shotSide": ["forehand", "backhand"], "contents": "Type: conditioned game\nParticipants: 2\nDuration: 60min\nIs_general: true\nPrimaryShots: null\nSecondaryShots: deep drive, hard drive, straight lob,  straight kill, deep cross,  cross kill, cross lob, counter drop, cross drop, wide cross\nShotTypes: drive, drop, cross, volley, lob\nShotSide: forehand, backhand\nsquashLevel: Advanced\nIntensity: High\nFitness: Medium\n\nLeg workout: High\nArm workout: Medium\nSupport doc: Null\n\nFocus: Mastering the Strategic Dynamics and Shot Execution in Cross-Court vs. Straight-Court Rallies.\nRest time between exercises: 1min30sec\n\n\nWARM-UP (10min)\n2min30sec: Boast– Drive – Drop – Drive (Sequence: Player A boasts → Player B drives → Player A drops → Player B drives)\n2min30sec: Boast – Drive 2 shots (keep same positions) (Sequence: Player A drives and then plays a boast (2 shots) → Player B drops and then plays a drives (2 shots)\nSwitch roles and repeat the exercises above\nSESSION\n\nConditioned Game 1\nFirst to 11 points: Cross versus Straight (rules: Player A is restricted to playing cross-court shots only. Player B is restricted to playing straight shots only)\nFirst to 11 points: Cross versus Straight (rules: Player B is restricted to playing cross-court shots only. Player A is restricted to playing straight shots only)\n\nConditioned Game 2\nFirst to 11 points: Cross with Boast versus Straight (rules: Player A is restricted to playing cross-court shots and boasts only. Player B is restricted to playing straight shots only)\nFirst to 11 points: Cross with Boast versus Straight (rules: Player B is restricted to playing cross-court shots and boasts only. Player A is restricted to playing straight shots only)\n\nConditioned Game 3\nFirst to 11 points: Cross with versus Straight Drives with Kills (rules: Player A is restricted to playing cross-court shots and boasts only. Player B is restricted to playing straight shots excluding drops)\nFirst to 11 points: Cross with versus Straight Drives with Kills (rules: Player B is restricted to playing cross-court shots and boasts only. Player A is restricted to playing straight shots excluding drops)\n\n\nEnd of session.\n\n\n\n\n\n\n\n\n\n"}
{"id": 24, "source": "Conditioned Games - Backhand Straight Game Using Different heights.docx", "type": "conditioned game", "participants": "2", "duration": "60min", "squashLevel": "Advanced", "fitness": "Medium", "intensity": "Medium", "primaryShots": ["counter drop", "straight drop", "volley straight drop", "deep drive", "hard drive", "straight drive", "straight kill", "straight lob", "volley drop"], "secondaryShots": ["counter drop", "straight drop", "volley straight drop", "deep drive", "hard drive", "straight drive", "straight kill", "straight lob", "volley drop"], "shots": ["drive", "lob", "drop", "boast", "volley", "kill"], "shotSide": ["backhand"], "contents": "Type: conditioned game\nParticipants: 2\nDuration: 60min\nIs_general: false\nPrimaryShots: straight drive, straight drop\nSecondaryShots: straight kill, straight drop, counter drop, straight lob\nShotTypes: volley, drive, lob, drop\nShotSide: backhand\nsquashLevel: Advanced\nIntensity: Medium\nFitness: Medium\n\nLeg workout: Medium\nArm workout: Medium\nSupport doc: Null\n\nFocus: Mastering Backhand Straight Game Strategy and Execution within Defined Frontwall Zones, specifically targeting different shot heights from low to high.\nRest time between exercises: 1min30sec\n\nWARM-UP (10min)\n2min30sec: Boast– Drive – Drop – Drive (Sequence: Player A boasts → Player B drives → Player A drops → Player B drives)\n2min30sec: Boast – Drive 2 shots (keep same positions) (Sequence: Player A drives and then plays a boast (2 shots) → Player B drops and then plays a drives (2 shots)\nSwitch roles and repeat the exercises above\n\nSESSION\nConditioned Game 1\nFirst to 7 points (backhand): Straight Drives (rules: Player A can play on Zone 1 and Zone 2. Player B can use Zone 2 and Zone 3)\nFirst to 7 points (backhand): Straight Drives (rules: Player A can play on Zone 2 and Zone 3. Player B can use Zone 1 and Zone 2)\n\nConditioned Game 2\nFirst to 7 points (backhand): Straight Drives with Volley Drop (rules: Both players can play on Zone 2 and Zone 3. Player A can play volley straight drop.  The response to the volley straight drop must be a straight lob)\nFirst to 7 points (backhand): Straight Drives with Volley Drop (rules: Both players can play on Zone 2 and Zone 3. Player B can play volley straight drop.  The response to the volley straight drop must be a straight lob)\nConditioned Game 3\nFirst to 7 points (backhand): Straight Drives with Drop (rules: Both players can play on Zone 2 and Zone 3. Player A can play straight drop if the ball bounced.  The response to the volley straight drop must be a straight lob)\nFirst to 7 points (backhand): Straight Drives with Drop (rules: Both players can play on Zone 2 and Zone 3. Player B can play straight drop if the ball bounced.  The response to the volley straight drop must be a straight lob)\nConditioned Game 4\nFirst to 7 points (backhand): Straight Drives with Drop and Counter (rules: Both players can play on Zone 2 and Zone 3. Player A can play straight drop if the ball bounced.  The response to the volley straight drop must be a straight lob or a counter drop)\nFirst to 7 points (backhand): Straight Drives with Drop and Counter (rules: Both players can play on Zone 2 and Zone 3. Player B can play straight drop if the ball bounced.  The response to the volley straight drop must be a straight lob or a counter drop)\nConditioned Game 5\nFirst to 11 points (backhand): Alley Game\nEnd of session.\n\nINSTRUCTIONS\nDefinition of Zones on the Front Wall – When you look at the front wall you could separate it into 3 different zones:\nThe bottom one (Zone 1) ⇒ Drop, kill, very hard drive area\nThe middle one (Zone 2) ⇒ Normal and deep drive area\nThe top one (Zone 3) ⇒ Lob area\n\n\n\n\n\n\n\n\n\n"}
{"id": 25, "source": "Conditioned Games - Straight Lobs from the front and Straight drops from the back.docx", "type": "conditioned game", "participants": "2", "duration": "60min", "squashLevel": "Medium", "fitness": "Medium", "intensity": "Medium", "primaryShots": ["straight drop", "volley straight drop", "deep drive", "hard drive", "straight drive", "volley straight drive", "straight kill", "cross kill", "lob cross", "hard cross", "straight lob"], "secondaryShots": ["straight drop", "volley straight drop", "deep drive", "hard drive", "straight drive", "volley straight drive", "straight kill", "cross kill", "lob cross", "hard cross", "straight lob"], "shots": ["drive", "cross", "lob", "drop", "boast", "volley", "kill"], "shotSide": ["forehand", "backhand"], "contents": "Type: conditioned game\nParticipants: 2\nDuration: 60min\nIs_general: false\nPrimaryShots: volley straight drive, straight drop, straight lob, volley straight drop\nSecondaryShots: deep drive, hard drive, deep cross, hard cross, lob cross, cross kill, straight kill\nShotTypes: volley, drive, cross, lob, drop, boast\nShotSide: forehand, backhand\nsquashLevel: Medium\nIntensity: Medium\nFitness: Medium\nIntensity: Medium\n\nLeg workout: Medium\nArm workout: Medium\nSupport doc: Null\n\nFocus: Mastering the Straight Game through Patterned Play, Strategic Lob-Based Rally Control, and Effective Volley Straight Interception\nRest time between exercises: 1min30sec\n\nWARM-UP (10min)\n2min30sec: Boast – Drive – Drop – Drive (Sequence: Player A boasts → Player B drives → Player A drops → Player B drives)\n2min30sec: Boast – Drive 2 shots (keep same positions) (Sequence: Player A drives and then plays a boast (2 shots) → Player B drops and then plays a drives (2 shots)\nSwitch roles and repeat the exercises above\nSESSION\nConditioned Game 1 (deep only)\nFirst to 9 points (forehand): Straight Lob – Drive – Drop (rules: Players must follow the sequence)\nFirst to 9 points (backhand): Straight Lob – Drive – Drop (rules: Players must follow the sequence)\n\nConditioned Game 2 (deep only)\nFirst to 9 points (forehand): Drives with Straight Drop from the back and Straight Lob (rules: Players must play straight drives behind the line. If you are standing behind your opponent and the ball bounced on the floor, you can play a straight drop. The response after the drops must be a straight lob)\nFirst to 9 points (forehand): Drives with Volley Straight Drop and Straight Lob (rules: Players must play deep shots behind the T-line. You can play a volley straight drop if you are standing in front of your opponent. The response after the drops must be a straight lob)\nConditioned Game 3\nFirst to 9 points (both sides): Length Game with Straight Drop from the back and Straight Lob (rules: Players must play straight drives behind the line. If you are standing behind your opponent and the ball bounced on the floor, you can play a straight drop. The response after the drops must be a straight lob)\nFirst to 9 points (both sides): Length Game with Volley Straight Drop and Straight Lob (rules: Players must play deep shots behind the T-line. You can play a volley straight drop if you are standing in front of your opponent. The response after the drops must be a straight lob)\n\nConditioned Game 4\nFirst to 11 points (both sides): Straight Lob – Deep – Short (rules: Players must follow the sequence. Deep shots must land behind the T-line. Short Can be any boasts or drops)\nFirst to 11 points (both sides): Straight Lob – Deep with Kills – Short (rules: Players must follow the sequence. Deep shots must have their second bounce landing behind the T-line. Short can be any boasts or drops)\n\nConditioned Game 5\nFirst to 11 points: Free Game\n\nEnd of session.\n\n\n\n\n\n\n\n \n"}
{"id": 26, "source": "Conditioned Games - Deep Drives with 1 boast or straight drop attacking options.docx", "type": "conditioned game", "participants": "2", "duration": "60min", "squashLevel": "Medium", "fitness": "Medium", "intensity": "Medium", "primaryShots": ["straight drop", "volley straight drop", "deep drive", "hard drive", "straight drive", "straight lob"], "secondaryShots": ["straight drop", "volley straight drop", "deep drive", "hard drive", "straight drive", "straight lob"], "shots": ["drive", "cross", "lob", "drop", "boast", "volley"], "shotSide": ["forehand", "backhand"], "contents": "Type: conditioned game\nParticipants: 2\nDuration: 60min\nIs_general: false\nPrimaryShots: deep drive, straight drop, 2-wall, 3-wall\nSecondaryShots: straight drive, hard drive, straight lob\nShotTypes: drive, drop, volley, lob\nShotSide: forehand, backhand\nsquashLevel: Medium\nIntensity: Medium\nFitness: Medium\nIntensity: Medium\n\nLeg workout: Medium\nArm workout: Medium\nSupport doc: Null\n\nFocus: Mastering Deep Straight Game Control with Strategic Integration of Limited Short Attacks.\nRest time between exercises: 1min30sec\n\nWARM-UP (10min)\n2min30sec: Boast– Drive – Drop – Drive (Sequence: Player A boasts → Player B drives → Player A drops → Player B drives)\n2min30sec: Boast – Drive 2 shots (keep same positions) (Sequence: Player A drives and then plays a boast (2 shots) → Player B drops and then plays a drives (2 shots)\nSwitch roles and repeat the exercises above\nSESSION\nConditioned Game 1 (deep only)\nFirst to 7 points (forehand): Deep Drives (rules: first bounce of the ball on the floor must land behind the T-line)\nFirst to 7 points (backhand): Deep Drives (rules: first bounce of the ball on the floor must land behind the T-line)\nConditioned Game 2\nFirst to 9 points (forehand): Deep Drives with 1 Straight Drop (rules: first bounce of the ball on the floor must land behind the T-line. Each player can play a straight drop off the bounce one time per rally. The response after the drop must be a deep straight)\nFirst to 9 points (backhand): Deep Drives with 1 Straight Drop (rules: first bounce of the ball on the floor must land behind the T-line. Each player can play a straight drop off the bounce one time per rally. The response after the drop must be a deep straight)\n\nConditioned Game 3\nFirst to 7 points (forehand): Deep Drives with 1 Boast (rules: first bounce of the ball on the floor must land behind the T-line. Each player can play a boast off the bounce one time per rally. The response after the drop must be a deep cross)\nFirst to 7 points (backhand): Deep Drives with 1 Boast (rules: first bounce of the ball on the floor must land behind the T-line. Each player can play a boast off the bounce one time per rally. The response after the drop must be a deep cross)\n\nConditioned Game 4\nFirst to 7 points (forehand): Deep Drives with 1 Volley Straight Drop (rules: first bounce of the ball on the floor must land behind the T-line. Each player can play a volley straight drop per rally. The response after the drop must be a deep straight)\nFirst to 7 points (backhand): Deep Drives with 1 Volley Straight Drop (rules: first bounce of the ball on the floor must land behind the T-line. Each player can play a volley straight drop per rally. The response after the drop must be a deep straight)\n\nConditioned Game 5\nFirst to 11 points: Free Game\n\nEnd of session.\n\n\n\n\n\n"}
{"id": 27, "source": "Conditioned Games - Alley Games from Deep Only to Full Alley_.docx", "type": "conditioned game", "participants": "2", "duration": "60min", "squashLevel": "Medium", "fitness": "Medium", "intensity": "Medium", "primaryShots": ["counter drop", "straight drop", "deep drive", "hard drive", "straight drive", "straight kill"], "secondaryShots": ["counter drop", "straight drop", "deep drive", "hard drive", "straight drive", "straight kill"], "shots": ["drive", "drop", "boast", "kill"], "shotSide": ["forehand", "backhand"], "contents": "Type: conditioned game\nParticipants: 2\nDuration: 60min\nIs_general: false\nPrimaryShots: straight drive, straight drop\nSecondaryShots: straight kill, deep drive, hard drive, straight drop, counter drop\nShotTypes: drive, drop\nShotSide: forehand, backhand\nsquashLevel: Medium\nIntensity: Medium\nFitness: Medium\nIntensity: Medium\n\nLeg workout: Medium\nArm workout: Medium\nSupport doc: Null\n\nFocus: Developing Foundational Straight Game Control\nRest time between exercises: 1min30sec\n\n\n\n\nWARM-UP (10min)\n2min30sec: Boast– Drive – Drop – Drive (Sequence: Player A boasts → Player B drives → Player A drops → Player B drives)\n2min30sec: Boast – Drive 2 shots (keep same positions) (Sequence: Player A drives and then plays a boast (2 shots) → Player B drops and then plays a drives (2 shots)\nSwitch roles and repeat the exercises above\n\nSESSION\nCondition Game 1\nFirst to 7 points (forehand): Drives (rules: first bounce must land behind the service line and the service box alley )\nFirst to 7 points (backhand): Drives (rules: first bounce must land behind the service line and the service box alley )\nCondition Game 2\nFirst to 7 points (forehand): Drives No Volleys (rules: each player has to place at least one foot on the T line after hitting their shot. If a player hits a shot and did not go back to the t-line before then the point is automatically lost. Kills are allowed)\nFirst to 7 points (backhand): Drives No Volleys (rules: each player has to place at least one foot on the T line after hitting their shot. If a player hits a shot and did not go back to the t-line before then the point is automatically lost. Kills are allowed)\n\nCondition Game 3\nFirst to 7 points (forehand): Drives with 1 Drop (rules: first bounce must land behind the service line and the service box alley. Once per rally you can play a straight drop in front of the service line. All other shots must be deep)\nFirst to 7 points (backhand): Drives with 1 Drop (rules: first bounce must land behind the service line and the service box alley. Once per rally you can play a straight drop in front of the service line. All other shots must be deep )\n\nCondition Game 4\nFirst to 11 points (forehand): Alley Game\nFirst to 11 points (backhand): Alley Game\n\nCondition Game 5\nFirst to 11 points: Free Game (rules: if squeeze your opponent with a straight shot, i.e. the ball was too tight against the side wall, then you win 2 points)\n\nEnd of session.\n\n"}
{"id": 28, "source": "Drill - Straight & Cross Variations.docx", "type": "drill", "participants": "2", "duration": "60min", "squashLevel": "Advanced", "fitness": "Medium", "intensity": "Medium", "primaryShots": ["deep drive", "hard drive", "straight drive", "straight kill", "lob cross", "hard cross", "straight lob"], "secondaryShots": ["deep drive", "hard drive", "straight drive", "straight kill", "lob cross", "hard cross", "straight lob"], "shots": ["drive", "cross"], "shotSide": ["forehand", "backhand"], "contents": "Type: drill\nParticipants: 2\nDuration: 60min\nSpecificShots: kill, lob, hard\nShots: drive, cross\nShotSide: forehand, backhand\nsquashLevel: Advanced\nIntensity: Medium\nFitness: Medium\nIntensity: Medium\n\nLeg workout: Medium\nArm workout: Medium\nSupport doc: Null\n\nFocus: learn different variations of drives and crosses from the back\nRest time between exercises: 1min30sec\nWARM-UP (10min)\n2min30sec: Boast – Drive – Drop – Drive\n2min30sec: Boast – Cross – Boast – Drive\nSwitch roles and repeat the exercises above\nSESSION\nExercise 1 (10min30sec)\n3min (forehand side): Deep straight drive – Deep straight drive – Hard Drive\n3min (forehand side): Deep straight drive – Deep straight drive – Straight Kill\n3min (forehand side): Deep straight drive – Deep straight drive – Straight Lob\nExercise 2 (Forehand drives - 10min30sec)\n3min (backhand side): Deep straight drive – Deep straight drive – Hard Drive\n3min (backhand side): Deep straight drive – Deep straight drive – Straight Kill\n3min (backhand side): Deep drive – Deep drive – Straight Lob\nExercise 3 (13min30sec)\n4min: Deep drive – Deep drive – Deep Cross (halftime: change cross side)\n4min: Deep drive – Deep drive – Hard Cross (halftime: change cross side)\n4min: Deep drive – Deep drive – Lob Cross (halftime: change cross side)\nExercise 2 (9min30sec)\n4min: Drives - Cross option (if in front of opponent)\n4min: Drives - Cross option (if drive hits the sidewall first)\nEnd of session.\n\n\n"}
{"id": 29, "source": "Drill - Straight Lob & Cross Lob from the front.docx", "type": "drill", "participants": "2", "duration": "60min", "squashLevel": "Advanced", "fitness": "Medium", "intensity": "Medium", "primaryShots": ["straight drop", "straight drive", "cross lob", "lob cross", "deep cross", "cross deep", "straight lob"], "secondaryShots": ["straight drop", "straight drive", "cross lob", "lob cross", "deep cross", "cross deep", "straight lob"], "shots": ["lob"], "shotSide": ["forehand", "backhand"], "contents": "Type: drill\nParticipants: 2\nDuration: 60min\nSpecificShots: cross lob, straight lob\nShots: lob\nShotSide: forehand, backhand\nsquashLevel: Advanced\nIntensity: Medium\nFitness: Medium\nIntensity: Medium\n\nLeg workout: Hard\nArm workout: Medium\nSupport doc: Null\n\nFocus: Using height from the front\nRest time between exercises: 1min30sec\n\n\nWARM-UP (10min)\n2min30sec: Boast– Drive – Drop – Drive\n2min30sec: Boast – Drive 2 shots\nSwitch roles and repeat the exercises above\nSESSION\nExercise 1 (9min30sec)\n4min (forehand side): Drop – Drive – Drop – Lob Straight \nPlayer A: stays in the back and plays drops only\nPlayer B: alternates shots, straight drive then straight lob\n4min (forehand side, but switch roles): Drop – Drive – Drop – Lob Straight \nExercise 2 (9min30sec)\n4min (backhand side): Drop – Drive – Drop – Lob Straight \nPlayer A: stays in the back and plays drops only\nPlayer B: alternates shots, straight drive then straight lob\n4min (backhand side, but switch roles): Drop – Drive – Drop – Lob Straight\nExercise 3 (9min30sec)\n4min (forehand side): Boast – Lob cross – Straight Drive\n4min (backhand side): Boast – Lob cross – Straight Drive\nExercise 4 (11min)\n4min: Front versus Back\nStart drill with a boast\nPlayer A: has the option to play boast or straight drop\nPlayer B: has the option to play cross lob or straight drive (deep or lob)\n4min (new options): Front versus Back\nStart drill with a boast\nPlayer A: has the option to play boast or straight drop\nPlayer B: has the option to play cross lob or straight drive (deep or lob)\n1min30sec rest\nSwitch roles and repeat both routines above\nExercise 6 (5min30sec)\n4min: Short – Deep (Lob) – Deep (any)\nStart with a boast\nDeep shot = shot first bounce behind the service line\nShort shot = second bounce in front of the service line\nExercise 7 (optional)\nFirst to 15 points Free Game\nWin 2 points if you win the rally with a Lob (winner or unforced error)\n\nEND OF SESSION\n"}
{"id": 30, "source": "Conditioned Games - Length, Alley & Diagonal Games.docx", "type": "conditioned game", "participants": "2", "duration": "60min", "squashLevel": "Medium", "fitness": "Medium", "intensity": "Medium", "primaryShots": ["straight drop", "volley straight drop", "deep drive", "hard drive", "straight drive", "volley hard drive", "volley straight drive", "straight kill", "cross kill", "cross lob", "deep cross", "cross deep", "hard cross", "volley cross", "volley hard cross", "straight lob"], "secondaryShots": ["straight drop", "volley straight drop", "deep drive", "hard drive", "straight drive", "volley hard drive", "volley straight drive", "straight kill", "cross kill", "cross lob", "deep cross", "cross deep", "hard cross", "volley cross", "volley hard cross", "straight lob"], "shots": ["drive", "cross", "lob", "drop", "boast", "volley", "kill"], "shotSide": ["forehand", "backhand"], "contents": "Type: conditioned game\nParticipants: 2\nDuration: 60min\nIs_general: true\nPrimaryShots: null\nSecondaryShots: volley straight drive, volley cross, volley hard cross, volley hard drive, straight kill, cross kill, hard drive, hard cross, deep drive, deep cross, volley straight drop, straight lob, cross lob\nShotTypes: volley, drive, cross, lob, drop, boast\nShotSide: forehand, backhand\nsquashLevel: Medium\nIntensity: Medium\nFitness: Medium\nIntensity: Medium\n\nLeg workout: Medium\nArm workout: Medium\nSupport doc: Null\n\nFocus: Mastering Precision and Strategic Exploitation within Diverse Zonal Play\nRest time between exercises: 1min30sec\n\nWARM-UP (10min)\n2min30sec: Boast– Drive – Drop – Drive (Sequence: Player A boasts → Player B drives → Player A drops → Player B drives)\n2min30sec: Boast – Drive 2 shots (keep same positions) (Sequence: Player A drives and then plays a boast (2 shots) → Player B drops and then plays a drives (2 shots)\nSwitch roles and repeat the exercises above\n\nSESSION\nCondition Game 1\nFirst to 11 points (both sides): Length Game With Kill (rules: second bounce needs to land behind the T line)\nFirst to 11 points (both sides): Length Game With Kill & Volley Straight Drop (rules: second bounce needs to land behind the T line and if volley you can attack using a volley straight drop. The following shot can either be a straight drop or any deep shot)\nCondition Game 2\nFirst to 11 points (forehand): Alley Game\nFirst to 11 points (backhand): Alley Game\n\nCondition Game 3\nFirst to 11 points (forehand): Diagonale Game (rules: the ball first bounce must land in the designated areas)\nFirst to 11 points (backhand): Diagonale Game (rules: the ball first bounce must land in the designated areas) \nCondition Game 4\nFirst to 11 points (forehand): 3/4\nFirst to 11 points (backhand): 3/4\nEnd of session."}
{"id": 31, "source": "Conditioned Games - Games in 2 and 3 zones of the court.docx", "type": "conditioned game", "participants": "2", "duration": "90min", "squashLevel": "Medium", "fitness": "Medium", "intensity": "Medium", "primaryShots": ["cross drop", "straight drop", "straight drive", "straight kill", "cross kill", "cross lob", "deep cross", "cross deep", "cross wide", "wide cross", "straight lob"], "secondaryShots": ["cross drop", "straight drop", "straight drive", "straight kill", "cross kill", "cross lob", "deep cross", "cross deep", "cross wide", "wide cross", "straight lob"], "shots": ["drive", "cross", "lob", "drop", "boast", "volley", "kill"], "shotSide": ["forehand", "backhand"], "contents": "Type: conditioned game\nParticipants: 2\nDuration: 90min\nIs_general: true\nPrimaryShots: null\nSecondaryShots: straight kill, cross kill, straight drive, straight drop, cross drop, cross lob, straight lob, cross wide, cross deep\nShotTypes: volley, drive, cross, lob, drop, boast\nShotSide: forehand, backhand\nsquashLevel: Medium\nIntensity: Medium\nFitness: Medium\nIntensity: Medium\n\nLeg workout: Medium\nArm workout: Medium\nSupport doc: Null\n\nFocus: Mastering Court Control and Strategic Shot Placement Through Zonal Play\nRest time between exercises: 1min30sec\n\nWARM-UP (10min)\n2min30sec: Boast– Drive – Drop – Drive (Sequence: Player A boasts → Player B drives → Player A drops → Player B drives)\n2min30sec: Boast – Drive 2 shots (keep same positions) (Sequence: Player A drives and then plays a boast (2 shots) → Player B drops and then plays a drives (2 shots)\nSwitch roles and repeat the exercises above\n\nSESSION\nConditioned Game 1\nFirst to 11 points (both sides): Length Game (rules: second bounce of the ball on the floor must land behind the T-line.)\nConditioned Game 2\nFirst to 11 points: 2-Zones Game (rules: Player A can play balls that can only land in the back and front right of the court. Player B can play in the back right and front left of the court)\nFirst to 11 points: 2-Zones Game (rules: Player B can play balls that can only land in the back and front right of the court. Player A can play in the back right and front left of the court)\nConditioned Game 3\nFirst to 11 points: 2-Zones Game (rules: Player A can play balls that can only land in the back and front left of the court. Player B can play in the back left and front right of the court)\nFirst to 11 points: 2-Zones Game (rules: Player B can play balls that can only land in the back and front left of the court. Player A can play in the back left and front right of the court)\nConditioned Game 3\nFirst to 11 points: 3-Zones Game (rules: Player A cannot play balls which land in the front left of the court. Player B cannot play balls which land in the front right of the court)\nFirst to 11 points: 3-Zones Game (rules: Player B cannot play balls which land in the front left of the court. Player A cannot play balls which land in the front right of the court)\n\nEnd of session.\n\n"}
