{"id": 0, "source": "Drill – Dealing With Crosses.docx", "type": "drill", "participants": "2", "duration": "45min", "squashLevel": "Advanced", "fitness": "Medium", "intensity": "Medium", "shots": ["volley", "cross"], "shotSide": ["forehand", "backhand"], "contents": "Type: drill\nParticipants: 2\nDuration: 45min\nShots: volley, cross\nShotSide: forehand, backhand\nsquashLevel: Advanced\nIntensity: Medium\nFitness: Medium\nIntensity: Medium\n\nLeg workout: Medium\nArm workout: Medium\n\nFocus: learn to play in the diagonals using volleys to counter mid or high crosses\nRest time between exercises: 1min30sec\nWARM-UP (10min)\n2min30sec: Boast – Drive – Drop – Drive\n2min30sec: Boast – Cross – Boast – Drive\nSwitch roles and repeat the exercises above\nSESSION\nExercise 1 (7min30sec)\n3min (forehand side): Boast – Cross 2 shots \n3min (forehand side): Boast – Cross 2 shots (switch roles)\nExercise 2 (7min30sec)\n3min (forehand side): Boast – BH Cross Lob – FH Soft Volley Deep Drive (Sequence)\n3min (backhand side): Boast – FH Cross Lob – BH Soft Volley Deep Drive (Sequence)\nExercise 3 (7min30sec)\n3min (forehand side): Boast – BH Cross Lob – FH Hard Volley Drive (Sequence)\n3min (backhand side): Boast – FH Cross Lob – BH Hard Volley Drive (Sequence)\nExercise 4 (7min30sec)\n3min (forehand side): Boast – BH Hard Cross – FH Volley Drive (Sequence)\n3min (backhand side): Boast – FH Hard Cross – BH Volley Drive (Sequence)\n\nExercise 5 (optional)\n11points (forehand side): Boast – BH Cross – FH Straight Drive (Sequence – with serve, returner’s defines the start of the sequence)\n11points (backhand side): Boast – FH Cross – BH Straight Drive (Sequence – with serve, returner’s defines the start of the sequence)\n\n\n\n"}
